python/perf-kernels/fused_moe/configs/device_name=AMD_Instinct_MI300X,dtype=int8_w8a8.json
{
  "small_M": {
    "BLOCK_SIZE_M": 64,
    "BLOCK_SIZE_N": 64,
    "BLOCK_SIZE_K": 128,
    "GROUP_SIZE_M": 4,
    "num_warps": 8,
    "num_stages": 2,
    "waves_per_eu": 0,
    "matrix_instr_nonkdim": 16,
    "kpack": 2
  },
  "medium_M": {
    "BLOCK_SIZE_M": 128,
    "BLOCK_SIZE_N": 128,
    "BLOCK_SIZE_K": 128,
    "GROUP_SIZE_M": 1,
    "num_warps": 8,
    "num_stages": 2,
    "waves_per_eu": 0,
    "matrix_instr_nonkdim": 16,
    "kpack": 2
  },
  "large_M": {
    "BLOCK_SIZE_M": 128,
    "BLOCK_SIZE_N": 128,
    "BLOCK_SIZE_K": 128,
    "GROUP_SIZE_M": 1,
    "num_warps": 8,
    "num_stages": 2,
    "waves_per_eu": 0,
    "matrix_instr_nonkdim": 16,
    "kpack": 2
  }
}
